{"$schema":"https://json-schema.org/draft/2020-12/schema","title":"Destinos","type":"array","items":{"type":"object","required":["id","name","image","overview","bestAreas","sections","googleMaps","budget","reservations"],"properties":{"id":{"type":"string"},"name":{"type":"string"},"image":{"type":"string"},"overview":{"type":"string"},"bestAreas":{"type":"array","items":{"type":"string"}},"sections":{"type":"object","additionalProperties":{"type":"array","items":{"type":"string"}}},"googleMaps":{"type":"string"},"budget":{"type":"string"},"reservations":{"type":"array","items":{"type":"string"}}}}}
