[
  {
    "id": "bangkok",
    "name": "Bangkok",
    "image": "https://upload.wikimedia.org/wikipedia/commons/2/24/Bangkok_Skyline_from_Movenpick_Hotel%2C_Asok%2C_Bangkok_at_night.jpg",
    "overview": "Big, intense and ideal for temples, rooftops, markets, malls and food.",
    "bestAreas": ["Siam", "Riverside", "Sukhumvit", "Old Town", "Chinatown"],
    "sections": {
      "Temples": ["Grand Palace", "Wat Pho", "Wat Arun"],
      "Restaurants": ["Chinatown street food", "Old Town Thai restaurants", "Food courts"],
      "Nightlife": ["Rooftop bars", "Khao San Road", "Sukhumvit"],
      "Shopping": ["MBK", "Siam Paragon", "Chatuchak"],
      "Markets": ["Pak Khlong Talat", "Yaowarat", "Talat Noi"],
      "Transport": ["Grab", "BTS/MRT", "Chao Phraya boats"],
      "Money": ["Cash for temples", "Compare exchange rates"],
      "Safety": ["Avoid tuk-tuk scams", "Agree prices first"],
      "Useful tips": ["Dress modestly for temples", "Start early", "Hydrate"]
    },
    "googleMaps": "https://maps.google.com/?q=Bangkok",
    "budget": "70-100 EUR/day excluding long-distance transport",
    "reservations": ["Hotels pending", "Rooftop pending", "Bangkok-Chiang Mai transport pending"]
  },
  {
    "id": "chiang-mai",
    "name": "Chiang Mai",
    "image": "https://upload.wikimedia.org/wikipedia/commons/1/1b/Chiang_Mai_sunday_evening_walking_street.jpg",
    "overview": "Northern Thailand base for temples, night markets, sanctuaries and day trips.",
    "bestAreas": ["Old City", "Nimman", "Night Bazaar"],
    "sections": {
      "Temples": ["Wat Chedi Luang", "Wat Phra Singh", "Doi Suthep"],
      "Restaurants": ["Khao soi shops", "Night Bazaar stalls"],
      "Nightlife": ["Nimman bars", "Night Bazaar"],
      "Shopping": ["Night Market", "Sunday Walking Street"],
      "Markets": ["Warorot", "Night Bazaar"],
      "Transport": ["Grab", "Songthaew", "Private driver"],
      "Money": ["Cash useful for markets"],
      "Safety": ["Choose ethical animal operators"],
      "Useful tips": ["Book sanctuary ahead", "Bring rain jacket"]
    },
    "googleMaps": "https://maps.google.com/?q=Chiang+Mai",
    "budget": "75-120 EUR/day depending on tours",
    "reservations": ["Hotel pending", "Elephant sanctuary pending", "Chiang Rai tour pending"]
  },
  {
    "id": "koh-tao",
    "name": "Koh Tao",
    "image": "https://upload.wikimedia.org/wikipedia/commons/d/d8/Panorama_Koh_Tao_3.jpg",
    "overview": "Island for diving, snorkeling, viewpoints and beach sunsets.",
    "bestAreas": ["Sairee Beach", "Mae Haad", "Chalok"],
    "sections": {
      "Temples": ["Small local temples"],
      "Restaurants": ["Beach restaurants", "Thai food shacks"],
      "Nightlife": ["Sairee Beach bars"],
      "Shopping": ["Dive shops"],
      "Markets": ["Convenience stores"],
      "Transport": ["Taxi truck", "Taxi boat", "Scooter only if insured"],
      "Money": ["Bring cash buffer"],
      "Safety": ["Helmet always", "Check dive insurance"],
      "Useful tips": ["Confirm ferry times", "Book dive center early"]
    },
    "googleMaps": "https://maps.google.com/?q=Koh+Tao",
    "budget": "85-140 EUR/day with diving",
    "reservations": ["Hotel pending", "Dive center pending", "Koh Nang Yuan boat pending"]
  },
  {
    "id": "krabi",
    "name": "Krabi",
    "image": "https://upload.wikimedia.org/wikipedia/commons/4/40/Railay_Beach_5.jpg",
    "overview": "Mainland beach base for Railay, longtail boats, cliffs and airport access.",
    "bestAreas": ["Ao Nang", "Railay", "Krabi Town"],
    "sections": {
      "Temples": ["Tiger Cave Temple optional"],
      "Restaurants": ["Ao Nang seafood", "Night market"],
      "Nightlife": ["Ao Nang beach bars"],
      "Shopping": ["Ao Nang shops"],
      "Markets": ["Krabi night market"],
      "Transport": ["Longtail boat", "Grab/local taxi", "Airport transfer"],
      "Money": ["Cash for boats"],
      "Safety": ["Check sea conditions"],
      "Useful tips": ["Keep ferry buffers", "Railay is boat access"]
    },
    "googleMaps": "https://maps.google.com/?q=Krabi",
    "budget": "75-120 EUR/day",
    "reservations": ["Hotel pending", "Ferries pending", "Airport transfer pending"]
  },
  {
    "id": "phi-phi",
    "name": "Phi Phi",
    "image": "https://upload.wikimedia.org/wikipedia/commons/0/0c/Phi_Phi_Viewpoint_2_Panoramic.jpg",
    "overview": "Compact island stop for viewpoints, Maya Bay, Pileh Lagoon and nightlife.",
    "bestAreas": ["Tonsai", "Loh Dalum", "Long Beach"],
    "sections": {
      "Temples": ["None planned"],
      "Restaurants": ["Beach restaurants", "Thai casual spots"],
      "Nightlife": ["Loh Dalum beach", "Fire shows"],
      "Shopping": ["Island shops"],
      "Markets": ["Small island stalls"],
      "Transport": ["Walk", "Longtail boat"],
      "Money": ["Bring cash"],
      "Safety": ["Watch boat/weather conditions"],
      "Useful tips": ["Book boat tour early", "Pack light"]
    },
    "googleMaps": "https://maps.google.com/?q=Phi+Phi+Islands",
    "budget": "100-140 EUR/day with boat tour",
    "reservations": ["Hotel pending", "Boat tour pending", "Ferry pending"]
  }
]
